under18,informed_consent,,yesno,Is subject a minor or dependent (less than 18 years of age or requires signature from authorized representative)?,,,,,,,,y,,,,,
dateconsent,informed_consent,,text,Date (in MM-DD-YYYY format),,,date_mdy,,,,,,,,,, @TODAY
subjectsig,informed_consent,,file,"Signature of Subject (if 18 years of age or older, please re-type name)",,,signature,,,,[under18] = '0',y,,,,,
parentname,informed_consent,,text,Name of Authorized Representative or Guardian,,,,,,,[under18] = '1',,,,,,
sigguardian,informed_consent,,file,Signature of Authorized Representative or Guardian ,,,signature,,,,[under18] = '1',y,,,,,
parentvsguardian,informed_consent,,radio,Relation to Subject (If consenting for minor),"0, Parent | 1, Legal Guardian or Legally Authorized Representative",,,,,,[under18] = '1',,,,,,
consentingperson,informed_consent,,text,Person responsible for obtaining consent,,,,,,,,,,,,, @HIDDEN-SURVEY
signatureconsentperson,informed_consent,,file,Signature of Person Responsible ,,,signature,,,,,,,,,, @HIDDEN-SURVEY
assentname,informed_consent,Assent to Take Part in this Research Study,text,"For children or adults with diminished capacity capable of providing assent, I have explained this study and the procedures involved in terms he/she could understand and that he/she freely assented to take part in this study to (enter subject name):",,,,,,,,,,,,,
assentexplanation,informed_consent,,radio,"The research study and consent form have been explained to you by Chelsea Kotch, MD","1, Yes | 2, No",,,,,,,,,,,,
assentdate,informed_consent,,text,Date of Meeting,,,date_mdy,,,,,,,,,,
assentsignature,informed_consent,,file,Signature of Subject,,,signature,,,,,,,,,,
assentnot,informed_consent,For children or adults with diminished capacity unable to assent:,text,I certify that the subject was not capable of understanding the procedures involved in the study sufficiently to assent to study participation (enter subject name):,,,,,,,,,,,,,
assentnotdate,informed_consent,,text,Date of Meeting,,,date_mdy,,,,,,,,,,
assentingperson,informed_consent,,text,Person responsible for obtaining assent,,,,,,,,,,,,, @HIDDEN-SURVEY
signatureassentperson,informed_consent,,file,Signature of Person Responsible ,,,signature,,,,,,,,,, @HIDDEN-SURVEY